{
  "$id": "https://github.com/klimPaskov/hoi4-agent-tools/blob/v4.1.0/schemas/probability-sweep-input.schema.json",
  "$schema": "https://json-schema.org/draft/2020-12/schema",
  "type": "object",
  "properties": {
    "workspaceId": {
      "default": "current",
      "type": "string",
      "pattern": "^[a-z][a-z0-9_-]{0,63}$"
    },
    "adapter": {
      "$ref": "#/$defs/__schema0"
    },
    "source": {
      "type": "object",
      "properties": {
        "identifier": {
          "$ref": "#/$defs/__schema1"
        },
        "path": {
          "$ref": "#/$defs/__schema2"
        },
        "snapshotPath": {
          "$ref": "#/$defs/__schema4"
        },
        "line": {
          "$ref": "#/$defs/__schema5"
        },
        "inlineClausewitz": {
          "$ref": "#/$defs/__schema6"
        },
        "virtualPatch": {
          "$ref": "#/$defs/__schema7"
        },
        "expectedSourceHash": {
          "$ref": "#/$defs/__schema8"
        }
      },
      "additionalProperties": false
    },
    "scenarioSet": {
      "type": "object",
      "properties": {
        "schemaVersion": {
          "default": "1.0",
          "type": "string",
          "const": "1.0"
        },
        "id": {
          "type": "string",
          "minLength": 1,
          "maxLength": 512
        },
        "workspaceId": {
          "type": "string",
          "pattern": "^[a-z][a-z0-9_-]{0,63}$"
        },
        "description": {
          "type": "string",
          "maxLength": 8192
        },
        "surfaceHint": {
          "$ref": "#/$defs/__schema0"
        },
        "scenarios": {
          "minItems": 1,
          "maxItems": 10000,
          "type": "array",
          "items": {
            "$ref": "#/$defs/__schema9"
          }
        }
      },
      "required": [
        "id",
        "scenarios"
      ],
      "additionalProperties": false
    },
    "candidatePool": {
      "maxItems": 100000,
      "type": "array",
      "items": {
        "$ref": "#/$defs/__schema60"
      }
    },
    "horizonDays": {
      "type": "number",
      "exclusiveMinimum": 0,
      "maximum": 1000000
    },
    "metrics": {
      "minItems": 1,
      "maxItems": 4,
      "type": "array",
      "items": {
        "$ref": "#/$defs/__schema61"
      }
    },
    "acceptanceBands": {
      "maxItems": 100000,
      "type": "array",
      "items": {
        "$ref": "#/$defs/__schema62"
      }
    },
    "diagnosticThresholds": {
      "type": "object",
      "properties": {
        "dominantProbability": {
          "type": "number",
          "minimum": 0,
          "maximum": 1
        },
        "dominantScenarioPrevalence": {
          "type": "number",
          "minimum": 0,
          "maximum": 1
        },
        "starvedProbability": {
          "type": "number",
          "minimum": 0,
          "maximum": 1
        },
        "negligibleCumulativeChance": {
          "type": "number",
          "minimum": 0,
          "maximum": 1
        },
        "extremeGrowthRatio": {
          "type": "number",
          "exclusiveMinimum": 0
        },
        "thresholdCliffDelta": {
          "type": "number",
          "exclusiveMinimum": 0
        },
        "rareOutcomeMinimumObservations": {
          "type": "integer",
          "exclusiveMinimum": 0,
          "maximum": 9007199254740991
        }
      },
      "additionalProperties": false
    },
    "outputs": {
      "maxItems": 10,
      "type": "array",
      "items": {
        "$ref": "#/$defs/__schema69"
      }
    },
    "refresh": {
      "type": "boolean"
    },
    "sweep": {
      "type": "object",
      "properties": {
        "paths": {
          "minItems": 1,
          "maxItems": 32,
          "type": "array",
          "items": {
            "$ref": "#/$defs/__schema70"
          }
        },
        "steps": {
          "default": 25,
          "type": "integer",
          "minimum": 2,
          "maximum": 10000
        },
        "pairwise": {
          "default": false,
          "type": "boolean"
        },
        "findRankReversals": {
          "default": true,
          "type": "boolean"
        }
      },
      "required": [
        "paths"
      ],
      "additionalProperties": false
    }
  },
  "required": [
    "adapter",
    "source",
    "scenarioSet",
    "sweep"
  ],
  "additionalProperties": false,
  "$defs": {
    "__schema0": {
      "type": "string",
      "enum": [
        "event_mean_time_to_happen",
        "event_option_ai_chance",
        "decision_ai_will_do",
        "mission_ai_will_do",
        "national_focus_ai_will_do",
        "technology_ai_will_do",
        "doctrine_ai_will_do",
        "direct_random",
        "random_list",
        "ai_strategy_factor",
        "custom_weighted_pool"
      ]
    },
    "__schema1": {
      "type": "string",
      "minLength": 1,
      "maxLength": 1024
    },
    "__schema2": {
      "$ref": "#/$defs/__schema3"
    },
    "__schema3": {
      "type": "string",
      "minLength": 1,
      "maxLength": 1024
    },
    "__schema4": {
      "$ref": "#/$defs/__schema3"
    },
    "__schema5": {
      "type": "integer",
      "minimum": 1,
      "maximum": 9007199254740991
    },
    "__schema6": {
      "type": "string",
      "maxLength": 16777216
    },
    "__schema7": {
      "type": "string",
      "maxLength": 16777216
    },
    "__schema8": {
      "type": "string",
      "pattern": "^[a-f0-9]{64}$"
    },
    "__schema9": {
      "type": "object",
      "properties": {
        "id": {
          "$ref": "#/$defs/__schema10"
        },
        "label": {
          "$ref": "#/$defs/__schema11"
        },
        "prevalence": {
          "$ref": "#/$defs/__schema12"
        },
        "actor": {
          "$ref": "#/$defs/__schema13"
        },
        "date": {
          "$ref": "#/$defs/__schema14"
        },
        "controls": {
          "$ref": "#/$defs/__schema15"
        },
        "state": {
          "$ref": "#/$defs/__schema18"
        },
        "flags": {
          "$ref": "#/$defs/__schema21"
        },
        "eventTargets": {
          "$ref": "#/$defs/__schema23"
        },
        "scopes": {
          "$ref": "#/$defs/__schema24"
        },
        "scopePools": {
          "$ref": "#/$defs/__schema27"
        },
        "candidateOverrides": {
          "$ref": "#/$defs/__schema37"
        },
        "uncertainInputs": {
          "$ref": "#/$defs/__schema38"
        },
        "correlations": {
          "$ref": "#/$defs/__schema54"
        },
        "schedule": {
          "$ref": "#/$defs/__schema56"
        }
      },
      "required": [
        "id",
        "state"
      ],
      "additionalProperties": false
    },
    "__schema10": {
      "type": "string",
      "minLength": 1,
      "maxLength": 512
    },
    "__schema11": {
      "type": "string",
      "maxLength": 4096
    },
    "__schema12": {
      "type": "number",
      "minimum": 0,
      "maximum": 1
    },
    "__schema13": {
      "type": "string",
      "maxLength": 256
    },
    "__schema14": {
      "type": "string",
      "maxLength": 64
    },
    "__schema15": {
      "type": "object",
      "propertyNames": {
        "$ref": "#/$defs/__schema16"
      },
      "additionalProperties": {
        "$ref": "#/$defs/__schema17"
      }
    },
    "__schema16": {
      "type": "string",
      "pattern": "^[1-9][0-9]{0,8}$"
    },
    "__schema17": {
      "type": "string",
      "pattern": "^[A-Z0-9]{3}$"
    },
    "__schema18": {
      "type": "object",
      "propertyNames": {
        "type": "string",
        "minLength": 1,
        "maxLength": 1024
      },
      "additionalProperties": {
        "$ref": "#/$defs/__schema19"
      }
    },
    "__schema19": {
      "anyOf": [
        {
          "$ref": "#/$defs/__schema20"
        },
        {
          "maxItems": 100000,
          "type": "array",
          "items": {
            "$ref": "#/$defs/__schema20"
          }
        }
      ]
    },
    "__schema20": {
      "anyOf": [
        {
          "type": "string",
          "maxLength": 4096
        },
        {
          "type": "number"
        },
        {
          "type": "boolean"
        },
        {
          "type": "null"
        }
      ]
    },
    "__schema21": {
      "maxItems": 100000,
      "type": "array",
      "items": {
        "$ref": "#/$defs/__schema22"
      }
    },
    "__schema22": {
      "type": "string",
      "minLength": 1,
      "maxLength": 512
    },
    "__schema23": {
      "type": "object",
      "propertyNames": {
        "type": "string",
        "maxLength": 512
      },
      "additionalProperties": {
        "type": "string",
        "maxLength": 512
      }
    },
    "__schema24": {
      "type": "object",
      "propertyNames": {
        "type": "string",
        "minLength": 1,
        "maxLength": 512
      },
      "additionalProperties": {
        "$ref": "#/$defs/__schema25"
      }
    },
    "__schema25": {
      "type": "object",
      "properties": {
        "id": {
          "type": "string",
          "minLength": 1,
          "maxLength": 512
        },
        "type": {
          "type": "string",
          "enum": [
            "country",
            "state",
            "character",
            "unit_leader",
            "operative",
            "strategic_region",
            "province",
            "unknown"
          ]
        },
        "actor": {
          "type": "string",
          "maxLength": 256
        },
        "state": {
          "default": {},
          "type": "object",
          "propertyNames": {
            "type": "string",
            "minLength": 1,
            "maxLength": 1024
          },
          "additionalProperties": {
            "$ref": "#/$defs/__schema19"
          }
        },
        "flags": {
          "maxItems": 100000,
          "type": "array",
          "items": {
            "$ref": "#/$defs/__schema26"
          }
        },
        "eventTargets": {
          "type": "object",
          "propertyNames": {
            "type": "string",
            "maxLength": 512
          },
          "additionalProperties": {
            "type": "string",
            "maxLength": 512
          }
        },
        "weight": {
          "anyOf": [
            {
              "type": "number",
              "minimum": 0
            },
            {
              "type": "string",
              "minLength": 1,
              "maxLength": 1024
            }
          ]
        }
      },
      "required": [
        "id"
      ],
      "additionalProperties": false
    },
    "__schema26": {
      "type": "string",
      "minLength": 1,
      "maxLength": 512
    },
    "__schema27": {
      "maxItems": 100000,
      "type": "array",
      "items": {
        "$ref": "#/$defs/__schema28"
      }
    },
    "__schema28": {
      "type": "object",
      "properties": {
        "id": {
          "$ref": "#/$defs/__schema29"
        },
        "bindAs": {
          "$ref": "#/$defs/__schema30"
        },
        "selection": {
          "$ref": "#/$defs/__schema31"
        },
        "complete": {
          "$ref": "#/$defs/__schema32"
        },
        "filter": {
          "$ref": "#/$defs/__schema33"
        },
        "candidates": {
          "$ref": "#/$defs/__schema36"
        }
      },
      "required": [
        "id",
        "candidates"
      ],
      "additionalProperties": false
    },
    "__schema29": {
      "type": "string",
      "minLength": 1,
      "maxLength": 512
    },
    "__schema30": {
      "default": "THIS",
      "type": "string",
      "minLength": 1,
      "maxLength": 512
    },
    "__schema31": {
      "default": "enumeration",
      "type": "string",
      "enum": [
        "enumeration",
        "uniform",
        "proportional_categorical"
      ]
    },
    "__schema32": {
      "default": false,
      "type": "boolean"
    },
    "__schema33": {
      "type": "object",
      "properties": {
        "inlineClausewitz": {
          "$ref": "#/$defs/__schema34"
        },
        "scriptedTrigger": {
          "$ref": "#/$defs/__schema35"
        }
      },
      "additionalProperties": false
    },
    "__schema34": {
      "type": "string",
      "minLength": 1,
      "maxLength": 1048576
    },
    "__schema35": {
      "type": "string",
      "minLength": 1,
      "maxLength": 512
    },
    "__schema36": {
      "minItems": 1,
      "maxItems": 100000,
      "type": "array",
      "items": {
        "$ref": "#/$defs/__schema25"
      }
    },
    "__schema37": {
      "type": "object",
      "propertyNames": {
        "type": "string",
        "maxLength": 512
      },
      "additionalProperties": {
        "type": "boolean"
      }
    },
    "__schema38": {
      "maxItems": 10000,
      "type": "array",
      "items": {
        "$ref": "#/$defs/__schema39"
      }
    },
    "__schema39": {
      "type": "object",
      "properties": {
        "path": {
          "$ref": "#/$defs/__schema40"
        },
        "range": {
          "$ref": "#/$defs/__schema41"
        },
        "alternatives": {
          "$ref": "#/$defs/__schema42"
        },
        "distribution": {
          "$ref": "#/$defs/__schema43"
        },
        "unresolved": {
          "$ref": "#/$defs/__schema53"
        }
      },
      "required": [
        "path"
      ],
      "additionalProperties": false
    },
    "__schema40": {
      "type": "string",
      "minLength": 1,
      "maxLength": 1024
    },
    "__schema41": {
      "type": "object",
      "properties": {
        "min": {
          "type": "number"
        },
        "max": {
          "type": "number"
        }
      },
      "required": [
        "min",
        "max"
      ],
      "additionalProperties": false
    },
    "__schema42": {
      "minItems": 1,
      "maxItems": 100000,
      "type": "array",
      "items": {
        "$ref": "#/$defs/__schema20"
      }
    },
    "__schema43": {
      "type": "object",
      "properties": {
        "kind": {
          "$ref": "#/$defs/__schema44"
        },
        "min": {
          "$ref": "#/$defs/__schema45"
        },
        "max": {
          "$ref": "#/$defs/__schema46"
        },
        "mode": {
          "$ref": "#/$defs/__schema47"
        },
        "mean": {
          "$ref": "#/$defs/__schema48"
        },
        "stddev": {
          "$ref": "#/$defs/__schema49"
        },
        "values": {
          "$ref": "#/$defs/__schema50"
        },
        "probabilities": {
          "$ref": "#/$defs/__schema51"
        }
      },
      "required": [
        "kind"
      ],
      "additionalProperties": false
    },
    "__schema44": {
      "type": "string",
      "enum": [
        "uniform",
        "triangular",
        "normal",
        "lognormal",
        "categorical",
        "empirical"
      ]
    },
    "__schema45": {
      "type": "number"
    },
    "__schema46": {
      "type": "number"
    },
    "__schema47": {
      "type": "number"
    },
    "__schema48": {
      "type": "number"
    },
    "__schema49": {
      "type": "number",
      "exclusiveMinimum": 0
    },
    "__schema50": {
      "minItems": 1,
      "maxItems": 100000,
      "type": "array",
      "items": {
        "$ref": "#/$defs/__schema20"
      }
    },
    "__schema51": {
      "minItems": 1,
      "maxItems": 100000,
      "type": "array",
      "items": {
        "$ref": "#/$defs/__schema52"
      }
    },
    "__schema52": {
      "type": "number",
      "minimum": 0,
      "maximum": 1
    },
    "__schema53": {
      "type": "boolean",
      "const": true
    },
    "__schema54": {
      "maxItems": 10000,
      "type": "array",
      "items": {
        "$ref": "#/$defs/__schema55"
      }
    },
    "__schema55": {
      "type": "object",
      "properties": {
        "left": {
          "type": "string",
          "minLength": 1,
          "maxLength": 1024
        },
        "right": {
          "type": "string",
          "minLength": 1,
          "maxLength": 1024
        },
        "coefficient": {
          "type": "number",
          "minimum": -1,
          "maximum": 1
        }
      },
      "required": [
        "left",
        "right",
        "coefficient"
      ],
      "additionalProperties": false
    },
    "__schema56": {
      "maxItems": 100000,
      "type": "array",
      "items": {
        "$ref": "#/$defs/__schema57"
      }
    },
    "__schema57": {
      "type": "object",
      "properties": {
        "atDay": {
          "type": "number",
          "minimum": 0
        },
        "set": {
          "type": "object",
          "propertyNames": {
            "type": "string",
            "maxLength": 1024
          },
          "additionalProperties": {
            "$ref": "#/$defs/__schema19"
          }
        },
        "clearFlags": {
          "maxItems": 100000,
          "type": "array",
          "items": {
            "$ref": "#/$defs/__schema58"
          }
        },
        "addFlags": {
          "maxItems": 100000,
          "type": "array",
          "items": {
            "$ref": "#/$defs/__schema59"
          }
        }
      },
      "required": [
        "atDay",
        "set"
      ],
      "additionalProperties": false
    },
    "__schema58": {
      "type": "string",
      "maxLength": 512
    },
    "__schema59": {
      "type": "string",
      "maxLength": 512
    },
    "__schema60": {
      "type": "string",
      "minLength": 1,
      "maxLength": 512
    },
    "__schema61": {
      "type": "string",
      "enum": [
        "conditional_probability",
        "raw_value",
        "cumulative_chance",
        "effective_mtth_days"
      ]
    },
    "__schema62": {
      "type": "object",
      "properties": {
        "id": {
          "$ref": "#/$defs/__schema63"
        },
        "label": {
          "$ref": "#/$defs/__schema64"
        },
        "scenarioId": {
          "$ref": "#/$defs/__schema65"
        },
        "candidateId": {
          "$ref": "#/$defs/__schema66"
        },
        "metric": {
          "$ref": "#/$defs/__schema61"
        },
        "min": {
          "$ref": "#/$defs/__schema67"
        },
        "max": {
          "$ref": "#/$defs/__schema68"
        }
      },
      "required": [
        "id",
        "candidateId",
        "metric"
      ],
      "additionalProperties": false
    },
    "__schema63": {
      "type": "string",
      "minLength": 1,
      "maxLength": 512
    },
    "__schema64": {
      "type": "string",
      "maxLength": 4096
    },
    "__schema65": {
      "type": "string",
      "minLength": 1,
      "maxLength": 512
    },
    "__schema66": {
      "type": "string",
      "minLength": 1,
      "maxLength": 512
    },
    "__schema67": {
      "type": "number"
    },
    "__schema68": {
      "type": "number"
    },
    "__schema69": {
      "type": "string",
      "enum": [
        "json",
        "ranking",
        "matrix",
        "waterfall",
        "timing",
        "sensitivity",
        "threshold",
        "sequence",
        "comparison",
        "unresolved"
      ]
    },
    "__schema70": {
      "type": "string",
      "minLength": 1,
      "maxLength": 1024
    }
  }
}
